{
  "project_name": "CLI App",
  "cli_names": [
    "cli_app"
  ],
  "description": "CLI App Description",
  "author": "Joe Bloggs",
  "author_email": "joebloggs@email.com",
  "license": "MIT",
  "classifiers": [
    "Intended Audience :: Developers",
    "Topic :: Utilities",
    "License :: Proprietry",
    "Natural Language :: English",
    "Operating System :: OS Independent"
  ],
  "url": null
}